{
  "$schema": "../schema/test.schema.json",
  "_note": "ЧЕРНОВИК: временные вопросы и тексты-заглушки. Заменить настоящим контентом.",
  "id": "love-languages",
  "slug": "love-languages",
  "kind": "test",
  "status": "draft",
  "title": "Языки любви",
  "description": "Как ты чувствуешь, что тебя любят? Узнай свой язык любви.",
  "emoji": "💌",
  "sections": ["solo", "pairs"],
  "tier": "free",
  "ageRating": "all",
  "players": { "min": 1, "max": 1 },
  "durationMin": 3,
  "tags": ["отношения", "о себе"],
  "related": ["know-each-other", "temperament"],
  "scoring": "types",

  "questions": [
    {
      "text": "Что тебя больше всего порадует после тяжёлого дня?",
      "options": [
        { "text": "«Ты сегодня огонь, горжусь тобой»", "type": "words" },
        { "text": "Вечер вдвоём без телефонов", "type": "time" },
        { "text": "Маленький сюрприз просто так", "type": "gifts" },
        { "text": "Кто-то сделал за меня дела", "type": "service" },
        { "text": "Долгие обнимашки", "type": "touch" }
      ]
    },
    {
      "text": "Тебе обиднее всего, когда…",
      "options": [
        { "text": "Тебя критикуют или не хвалят", "type": "words" },
        { "text": "Человек весь вечер в телефоне", "type": "time" },
        { "text": "Забыли про твой праздник", "type": "gifts" },
        { "text": "Обещали помочь — и не помогли", "type": "service" },
        { "text": "Держат дистанцию", "type": "touch" }
      ]
    },
    {
      "text": "Как ты сам(а) показываешь симпатию?",
      "options": [
        { "text": "Пишу тёплые сообщения", "type": "words" },
        { "text": "Зову провести время вместе", "type": "time" },
        { "text": "Дарю что-то со смыслом", "type": "gifts" },
        { "text": "Помогаю делом", "type": "service" },
        { "text": "Обнимаю, держу за руку", "type": "touch" }
      ]
    },
    {
      "text": "Идеальное свидание — это:",
      "options": [
        { "text": "Разговор, где говорят приятные вещи", "type": "words" },
        { "text": "Целый день только вдвоём", "type": "time" },
        { "text": "Когда тебе приготовили подарок", "type": "gifts" },
        { "text": "Когда всё организовали за тебя", "type": "service" },
        { "text": "Кино под одним пледом", "type": "touch" }
      ]
    },
    {
      "text": "Какое сообщение хочется перечитывать?",
      "options": [
        { "text": "Длинное признание", "type": "words" },
        { "text": "«Освободил(а) для тебя всю субботу»", "type": "time" },
        { "text": "«Увидел(а) это и вспомнил(а) тебя 🎁»", "type": "gifts" },
        { "text": "«Не парься, я всё решил(а)»", "type": "service" },
        { "text": "«Скучаю по твоим объятиям»", "type": "touch" }
      ]
    }
  ],

  "results": [
    {
      "id": "words",
      "title": "Слова поддержки",
      "emoji": "💬",
      "text": "[черновик] Тебе важно слышать, что тебя ценят. Комплимент или «горжусь тобой» заряжают тебя на весь день.",
      "deepTeaser": { "tier": "premium", "text": "[черновик] Как попросить партнёра говорить то, что тебе нужно…" }
    },
    {
      "id": "time",
      "title": "Время вместе",
      "emoji": "⏳",
      "text": "[черновик] Для тебя любовь — это внимание без отвлечений. Телефон в сторону — и ты счастлив(а).",
      "deepTeaser": { "tier": "premium", "text": "[черновик] 10 идей качественного времени вдвоём…" }
    },
    {
      "id": "gifts",
      "title": "Подарки",
      "emoji": "🎁",
      "text": "[черновик] Дело не в цене, а в том, что о тебе подумали. Мелочь со смыслом — лучшее признание.",
      "deepTeaser": { "tier": "premium", "text": "[черновик] Почему для тебя важны символы и как об этом сказать…" }
    },
    {
      "id": "service",
      "title": "Помощь делом",
      "emoji": "🛠️",
      "text": "[черновик] Слова — это хорошо, но поступки громче. Тебя трогает, когда о тебе заботятся на деле.",
      "deepTeaser": { "tier": "premium", "text": "[черновик] Как не путать заботу с обязанностями…" }
    },
    {
      "id": "touch",
      "title": "Прикосновения",
      "emoji": "🤗",
      "text": "[черновик] Обнимашки, рука в руке — так ты чувствуешь близость лучше любых слов.",
      "deepTeaser": { "tier": "premium", "text": "[черновик] Что делать, если у партнёра другой язык любви…" }
    }
  ]
}
